{"$schema":"https://json-schema.org/draft/2020-12/schema","$id":"mutation.schema.json","type":"object","additionalProperties":false,"required":["schemaVersion","id","baseCaseId","familyId","title","version","change","expectations","affectedDimensions","stableDimensions"],"properties":{"schemaVersion":{"const":1},"id":{"type":"string"},"baseCaseId":{"type":"string"},"familyId":{"type":"string"},"title":{"type":"string"},"version":{"type":"string"},"change":{"type":"string"},"expectations":{"type":"string"},"affectedDimensions":{"type":"array","items":{"type":"string"},"minItems":1},"stableDimensions":{"type":"array","items":{"type":"string"},"minItems":1}}}
