{"schemaVersion":1,"id":"01-appointment-booking.regulated-multitenant","baseCaseId":"01-appointment-booking","familyId":"01-appointment-booking","title":"Regulated Multi-Tenant Appointment SaaS","version":"1.0","change":"public/change.md","expectations":"private/expectations.json","affectedDimensions":["tenant isolation","authorization","audit","data ownership"],"stableDimensions":["booking non-overlap","commit-before-notification","proportional failure handling"]}
