{"schemaVersion":1,"id":"02-offline-document-indexer.hostile-documents","baseCaseId":"02-offline-document-indexer","familyId":"02-offline-document-indexer","title":"Offline Indexer with Hostile Documents","version":"1.0","change":"public/change.md","expectations":"private/expectations.json","affectedDimensions":["parser trust boundary","resource limits","compromise response"],"stableDimensions":["filesystem source of truth","offline operation","reconciliation"]}
