{"schemaVersion":1,"id":"04-high-throughput-event-ingestion.multi-region-ingestion","baseCaseId":"04-high-throughput-event-ingestion","familyId":"04-high-throughput-event-ingestion","title":"Multi-Region Event Ingestion","version":"1.0","change":"public/change.md","expectations":"private/expectations.json","affectedDimensions":["geographic availability","replication","authority/failover"],"stableDimensions":["per-key ordering","idempotency","backpressure","poison work"]}
